Identifier,RG/MS Number,Collection Title,"Box, Folder, URL",Date,Subjects,People,Title,Item Description,Reviewed
band.nsp.0141,nebnewspapers,The Daily Nebraskan,https://nebnewspapers.unl.edu/lccn/sn96080312/1928-11-21/ed-1/seq-1/#words=Band+band+cadet+Cadet+Cadets+Rally+rally,1928-11-21,Fundraising & Finance; Travel; Sports,"Jones, Biff",Eyes of America Are On Saturday's Great Game Between Nebraska-Army,"After a large rally, the football team and band will be departing on the Cornhusker Special for West Point, where a lot is riding on the results of the Army vs Nebraska game. The band raised $5,000 in order to send 50 members to New York, where they will play to the 25,000 stadium.",
band.nsp.0142,nebnewspapers,The Daily Nebraskan,https://nebnewspapers.unl.edu/lccn/sn96080312/1928-10-04/ed-1/seq-1/#words=Band+band+cadet+rallies+RALLY+rally,1928-10-04,Military,-,Elton Fee Receives Medal as Marskman,"Article describes general R. O. T. C. news, including that the band has grown in size, possibly because of the possibility of going on the West Point trip, and now has 85 active members and 99 total members.",
band.nsp.0143,nebnewspapers,The Daily Nebraskan,https://nebnewspapers.unl.edu/lccn/sn96080312/1928-10-04/ed-1/seq-1/#words=Band+band+cadet+rallies+RALLY+rally,1928-10-04,Cheer & Pep; Sports; Parade,-,Send-Off Rally Starts Tonight at Five O'Clock,"The band will perform at a parade from Social Sciences to the stadium before the football team leaves for Ames, Iowa. The cost to attend the Iowa State game is $2.50 and the train ticket costs $9.15.",
band.nsp.0144,nebnewspapers,The Daily Nebraskan,https://nebnewspapers.unl.edu/lccn/sn96080312/1925-09-30/ed-1/seq-1/#words=band+Band+cadet+Cadet+cadets+rally+RALLY,1925-09-30,Cheer & Pep; Sports; Parade,"Bearg, Ernest",Plan Rally to Give Team Big Sendoff,The band will lead a parade from the Armory to Burlington Station to see the football team off to Illinois.,
band.nsp.0145,nebnewspapers,The Daily Nebraskan,https://nebnewspapers.unl.edu/lccn/sn96080312/1929-04-10/ed-1/seq-1/#words=band+Band+cadet+Cadet+cadets+rally,1929-04-10,Drill; Military; Parade,"Jewett, F. F.",R. O. T. C. Regiment Appears at Review,"The Cadets give a review, led by the band in preparation for competitions. The drill field is in poor condition.",
band.nsp.0146,nebnewspapers,The Daily Nebraskan,https://nebnewspapers.unl.edu/lccn/sn96080312/1929-04-10/ed-1/seq-1/#words=band+Band+cadet+Cadet+cadets+rally,1929-04-10,Parade; Drill; Military; Sports; Concert,"Quick, W. T.",R. O. T. C. Band Makes First Official Outdoor Appearance at Cadet Parade,"The 99 member band performs at the first review of the spring. The article describes the band's additional duties, which include playing for football and basketball games, performing concert music, leading pep rallies and parades, and drilling multiple times a week.",
band.nsp.0147,nebnewspapers,The Daily Nebraskan,https://nebnewspapers.unl.edu/lccn/sn96080312/1925-11-26/ed-1/seq-1/#words=band+cadet+Cadet+rallies+RALLY+rally,1925-11-26,Cheer & Pep; Sports,-,Students Give Vent to Spirit in Great Rally,"Thousands of students carrying torches, accompanied by the band, parade to the hotel where the Notre Dame team is staying to hear speeches by the Notre Dame players.",
band.nsp.0148,nebnewspapers,The Daily Nebraskan,https://nebnewspapers.unl.edu/lccn/sn96080312/1926-11-10/ed-1/seq-1/#words=band+cadet+cadets+CADETS+rallies+rally+RALLY,1926-11-10,Cheer & Pep; Homecoming,-,Husker Rally Friday Night,"Students will gather at the Coliseum for a homecoming rally, with music provided by the R. O. T. C. band",
band.nsp.0149,nebnewspapers,The Daily Nebraskan,https://nebnewspapers.unl.edu/lccn/sn96080312/1926-11-10/ed-1/seq-1/#words=band+cadet+cadets+CADETS+rallies+rally+RALLY,1926-11-10,Parade,-,Cadets March Armistice Day,"The Cadets and band will take part in an Armistice Day parade along with local organizations. The parade route, which the Cadets will join at 17th and O, begans at 15th and N as follows: ""east on N to 17th street, north on 17th to O, west on O to 9th, south of N, east on N to 13th, and south on 13th to M.""",
band.nsp.0150,nebnewspapers,The Daily Nebraskan,https://nebnewspapers.unl.edu/lccn/sn96080312/1928-10-25/ed-1/seq-3/#words=BAND+band+bands+cadet+rallies+Rally+rally+RALLYY,1928-10-25,Cheer & Pep; Sports; Homecoming; Parade,-,Bonfire Rally on Drill Field Homecoming,The largest bonfire in NU's history is planned after which the band will lead fans in a torchlight parade to the Lincoln Hotel to hear from the Missouri team.,
band.nsp.0151,nebnewspapers,The Daily Nebraskan,https://nebnewspapers.unl.edu/lccn/sn96080312/1928-10-25/ed-1/seq-3/#words=BAND+band+bands+cadet+rallies+Rally+rally+RALLYY,1928-10-25,Fundraising & Finance; Events & Dances,-,Students are Slow to Buy Band Tickets,"The R. O. T. C. band is not selling as many tickets for its benefit ball as they hoped, putting their trip to West Point in jeopardy. Herb Fick's Missouri Quadrangle orchestra will be playing at the ball, which Missouri football fans are also expected to attend after the game.",
band.nsp.0152,nebnewspapers,The Daily Nebraskan,https://nebnewspapers.unl.edu/lccn/sn96080312/1920-10-01/ed-1/seq-1/#words=Band+Cadet+rallies+Rally+rally+RALLY,1920-10-01,Cheer & Pep; Sports,"Schulte, Henry",Stage Initial Rally Tonight,"The first rally of the year will take place at 7 pm at the Armory. The band will play songs and lead an ""Indian chant.""",
band.nsp.0153,nebnewspapers,The Daily Nebraskan,https://nebnewspapers.unl.edu/lccn/sn96080312/1923-11-22/ed-1/seq-1/#words=band+Cadet+RALLY+rally+Rally+rallying,1923-11-22,Cheer & Pep; Sports,"Dawson, Fred",Rally Friday to Prepare for Foe,The band will perform at a rally north of the Administration building to prepare for the Syracuse game,
band.nsp.0154,nebnewspapers,The Daily Nebraskan,https://nebnewspapers.unl.edu/lccn/sn96080312/1925-11-20/ed-1/seq-1/#words=Band+cadet+rally+Rally+RALLY+rallys,1925-11-20,Cheer & Pep; Sports; Parade,-,Irish Accept Invitiation to Husker Rally,"The Notre Dame football team will be attending a bonfire and torch parade, led by the band through the business district.",
band.nsp.0155,nebnewspapers,The Daily Nebraskan,https://nebnewspapers.unl.edu/lccn/sn96080312/1925-10-23/ed-1/seq-1/#words=Band+band+cadet+cadets+Cadets+CADETS+rallies+RALLY+rally+Rally,1925-10-23,Cheer & Pep; Sports; Homecoming,-,Plan Rally for Tonight,The band will perform at a brief homecoming bonfire and rally to prepare the football team for the Kansas game.,
band.nsp.0156,nebnewspapers,The Daily Nebraskan,https://nebnewspapers.unl.edu/lccn/sn96080312/1932-03-08/ed-1/seq-1/,1932-03-08,Uniform & Equipment,"Selleck, John K.","Band Gets Seven New Instruments: Five Foot Drum, Two Lyres, Four Special Trumpets Purchased",The R.O.T.C. band debuts new instruments at a Nebraska vs. Creighton basketball game.,
band.nsp.0157,nebnewspapers,The Daily Nebraskan,https://nebnewspapers.unl.edu/lccn/sn96080312/1933-11-23/ed-1/seq-4/,1933-11-23,Band Day; Other Band; Parade,-,Strike Up the Band,The advertisement describes upcoming band day events.,
band.nsp.0158,nebnewspapers,The Daily Nebraskan,https://nebnewspapers.unl.edu/lccn/sn96080312/1935-10-22/ed-1/seq-1/,1935-10-22,Band Day; Other Band; Parade,"Quick, W. T.",Dads Tops on Campus Saturday: University Plays Host to Fathers,High school bands will perform in a parade and pregame show during Band Day/Dad's Day celebrations.,
band.nsp.0159,nebnewspapers,The Daily Nebraskan,https://nebnewspapers.unl.edu/lccn/sn96080312/1935-11-10/ed-1/seq-2/,1935-11-10,Uniform & Equipment; Other Band,-,Say It With Music,The Kansas band is praised in comparison to a lackluster Nebraska band. The band uniforms are criticized as well as its membership and spirit.,
band.nsp.0160,nebnewspapers,The Daily Nebraskan,https://nebnewspapers.unl.edu/lccn/sn96080312/1936-02-27/ed-1/seq-1/,1936-02-27,Uniform & Equipment; Fundraising & Finance,"Oury, W. H.; Selleck, John K.","Nebraska Band to Wear New, Colorful Uniforms Next Fall","At band banquet, W.H. Oury announces the band's new scarlet and cream uniforms will replace uniforms in ROTC colors. He also discusses reorginization of the band's membership with decreased number for performances.",
band.nsp.0161,nebnewspapers,The Daily Nebraskan,https://nebnewspapers.unl.edu/lccn/sn96080312/1936-10-04/ed-1/seq-1/,1936-10-4,Band Day; Other Band; Parade; Pregame & Halftime,"Quick, W. T.",27 Out State Bands Go On Parade Before Husker-Cyclone Tilt,"Ninety-six ROTC band members, wearing new uniforms will lead the parade on Band Day. The article describes the Band Day performance and songs under ""Billy"" Quick's leadership.",
band.nsp.0162,nebnewspapers,The Daily Nebraskan,https://nebnewspapers.unl.edu/lccn/sn96080312/1937-05-20/ed-1/seq-1/,1937-05-20,Uniform & Equipment,"Quick, W. T.","""Billy"" Quick Reminisces on 19 Happy Years as Band Director",A brief article about Quick's career discusses his experience prior to and during his time leading the band.,
band.nsp.0163,nebnewspapers,The Daily Nebraskan,https://nebnewspapers.unl.edu/lccn/sn96080312/1937-10-14/ed-1/seq-1/,1937-10-14,Band Day; Other Band; Pregame & Halftime,"Quick, W. T.",Husker-Sooner Tilt to Feature 38 Prep Bands at Halftime,Special performances for Band Day and Dad's Day include bands from Nebraska and Iowa communities.,
band.nsp.0164,nebnewspapers,The Daily Nebraskan,https://nebnewspapers.unl.edu/lccn/sn96080312/1939-10-15/ed-1/seq-8/,1939-10-15,Uniform & Equipment,-,"Features Fly, Legs Flash, Signals are Barked as Baton Boys Strut Their Stuff in Stadium",The article discusses the role and appearance of baton twirlers and the drum major.,
band.nsp.0165,nebnewspapers,The Daily Nebraskan,https://nebnewspapers.unl.edu/lccn/sn96080312/1939-10-06/ed-1/seq-1/#words=band+March+march+marching+Marching+rallies+rally+Rally,1939-10-06,Cheer & Pep; Sports; Pregame & Halftime,-,"Thousands Flood Campus for the Weekend: Rally, Presentation of Pep Queen, Dances Lend Excitement","A rally will be held at the Union, followed by a parade and dance. The band's halftime performance at the football game will be broadcast coast to coast for the first time.",
band.nsp.0166,nebnewspapers,The Daily Nebraskan,https://nebnewspapers.unl.edu/lccn/sn96080312/1938-10-06/ed-1/seq-4/#words=band+Band+marching+Marching+RALLY,1938-10-06,Audition,"Lentz, Donald A.",Lentz Selects Band Men: Marching Tooters Drill Game-Day Formations,Director Don Lentz announces varsity band members after tryouts.,
band.nsp.0167,nebnewspapers,The Daily Nebraskan,https://nebnewspapers.unl.edu/lccn/sn96080312/1938-09-29/ed-1/seq-2/#words=Band+band+March+marching+rallies+rally,1938-09-29,Audition; Uniform & Equipment,"Lentz, Donald A.",Lentz to Whittle Band to 98 Men,"Director Don Lentz is cutting varsity band from 113 to 98 members. New ""West Point"" style uniforms are being ordered for twirlers, and popular music will be added to the band's repetoire. An editorial above the article states the band needs improvement.",
band.nsp.0168,nebnewspapers,The Daily Nebraskan,https://nebnewspapers.unl.edu/lccn/sn96080312/1939-10-20/ed-1/seq-1/#words=band+Marching+rally,1939-10-20,Cheer & Pep; Sports; Parade,-,"Uni Rooters Stage Baylor Rally Tonight: Victory Bell Parade, Bonfire Pep Meeting Will Begin at 7 p.m.",The band will march in a parade from the Union to the bonfire rally.,
band.nsp.0169,nebnewspapers,The Daily Nebraskan,https://nebnewspapers.unl.edu/lccn/sn96080312/1938-11-10/ed-1/seq-1/#words=band+March+march+marching+Rally+rally+rallying,1938-11-10,Cheer & Pep; Sports; Parade; Military,-,Rifles Join in Pitt Rally: Drill Unit Aids Husker Pep in Panther Hunt,"In an Armistice Day ceremony, the Pershing Rifles will join the varsity band and cheerleaders in a rally and parade before the Nebraska vs. Pitt football game. Another article, ""Memorial Service Precedes Game,"" describes a pregame ceremony to honor students killed in World War I.",
band.nsp.0170,nebnewspapers,The Daily Nebraskan,https://nebnewspapers.unl.edu/lccn/sn96080312/1929-11-20/ed-1/seq-1/#words=band+cadet+Cadet+RALLIES+Rallies+rallies+Rally+rally+rallying,1929-11-20,Cheer & Pep; Parade,-,Corn Cobs Prepare to Increase Spirit,University band will lead procession in the midst of several rallies before the Aggie football game.,
band.nsp.0171,nebnewspapers,The Daily Nebraskan,https://nebnewspapers.unl.edu/lccn/sn96080312/1929-11-20/ed-1/seq-1/#words=band+cadet+Cadet+RALLIES+Rallies+rallies+Rally+rally+rallying,1929-11-20,Travel,"Selleck, John K.",Nebraska Students Buy Kansas Tickets,"Students can purchase football tickets for the upcoming game in Manhattan, Kansas. The band will also be making the trip to play.",
band.nsp.0172,nebnewspapers,The Daily Nebraskan,https://nebnewspapers.unl.edu/lccn/sn96080312/1922-11-26/ed-1/seq-1/#words=band+cadet+cadets+Cadets+rally,1922-11-26,Sports; Pregame & Halftime,-,Nebraska Squad Shows up Ames in Every Department,The band plays at halftime during the Iowa State home game,
band.nsp.0173,nebnewspapers,The Daily Nebraskan,https://nebnewspapers.unl.edu/lccn/sn96080312/1923-10-14/ed-1/seq-1/#words=Band+cadet+rally+RALLY,1923-10-14,Cheer & Pep; Sports,-,Hold Rally on Eve of Oklahoma Game,"The band plays at a rally featuring a quartet, new song, and speeches.",
band.nsp.0174,nebnewspapers,The Daily Nebraskan,https://nebnewspapers.unl.edu/lccn/sn96080312/1923-10-03/ed-1/seq-1/#words=band+Band+cadet+rally+Rally,1923-10-03,Cheer & Pep; Parade,-,Students Plan Send-Off for Team Thursday,"The band will play at the Armory before a parade to the Burlington Station, where the football team is leaving for Illinois.",
band.nsp.0175,nebnewspapers,The Daily Nebraskan,https://nebnewspapers.unl.edu/lccn/sn96080312/1924-10-05/ed-1/seq-1/#words=band+cadet+rally+RALLY,1924-10-05,Cheer & Pep; Sports,-,Huskers Meet for Big Rally,"1,500 students take part in a rally before the Illinois game. The band led the students in song.",
band.nsp.0176,nebnewspapers,The Daily Nebraskan,https://nebnewspapers.unl.edu/lccn/sn96080312/1924-11-11/ed-1/seq-1/#words=band+cadet+rallies+Rallies+rally+RALLY,1924-11-11,Cheer & Pep; Sports,-,Hartley Will Talk at Rally,Former Husker captain speaks at Armory rally. The band will be traveling to Notre Dame for the game.,
band.nsp.0177,nebnewspapers,The Daily Nebraskan,https://nebnewspapers.unl.edu/lccn/sn96080312/1924-11-11/ed-1/seq-1/#words=band+cadet+rallies+Rallies+rally+RALLY,1924-11-11,Cheer & Pep; Sports,-,Plan Send-Off for Cornhuskers,The band will lead a crowd in songs as the football team leaves from the train station at 9th and S streets. This follows a rally the previous day.,
band.nsp.0178,nebnewspapers,The Daily Nebraskan,https://nebnewspapers.unl.edu/lccn/sn96080312/1928-10-23/ed-1/seq-1/#words=BAND+Band+Cadet+rally+RALLY+Rally,1928-10-23,Homecoming; Events & Dances; Fundraising & Finance,-,Party Ticket Sale Is Well Under Way,Tickets are being sold for the Homecoming R. O. T. C. Band Ball as a fundraiser for the band to travel to West Point. Downtown businesses are supporting the fundraiser. Herb Fick and his Missouri Quadrangle Colleagians will provide music for the dance. ,
band.nsp.0179,nebnewspapers,The Daily Nebraskan,https://nebnewspapers.unl.edu/lccn/sn96080312/1928-10-23/ed-1/seq-1/#words=BAND+Band+Cadet+rally+RALLY+Rally,1928-10-23,Parade; Cheer & Pep,-,Giant Rally to be Held Friday Night,The band will lead a parade on the eve of Homecoming to the Lincoln hotel where the Missouri football team is staying.,
band.nsp.0180,nebnewspapers,The Daily Nebraskan,https://nebnewspapers.unl.edu/lccn/sn96080312/1923-10-12/ed-1/seq-1/#words=band+Band+cadet+rally+RALLY+Rally,1923-10-23,Cheer & Pep,-,Rally for First Home Game Will Be Held Tonight,The band will play at an Armory rally for the Oklahoma game.,
band.nsp.0181,nebnewspapers,The Daily Nebraskan,https://nebnewspapers.unl.edu/lccn/sn96080312/1927-11-17/ed-1/seq-1/#words=Band+band+bands+cadet+RALLY+rally,1927-11-17,Meetings & Membership,-,Gamma Lambda Elects,"Elections are held for the honorary band fraternity, Gamma Lambda's, membership. The organization plans to add several more college bands as chapters.",
band.nsp.0182,nebnewspapers,The Daily Nebraskan,https://nebnewspapers.unl.edu/lccn/sn96080312/1927-11-17/ed-1/seq-1/#words=Band+band+bands+cadet+RALLY+rally,1927-11-17,Parade; Travel; Cheer & Pep,-,Train Arrival Starts Rally in Manhattan,"A rally is planned in Manhattan, Kansas, when the train carrying the football team, cheerleaders, band, and fans arrives. They will parade from the downtown district to Gillette hotel, where the football team is staying.",
band.nsp.0183,nebnewspapers,The Daily Nebraskan,https://nebnewspapers.unl.edu/lccn/sn96080312/1925-10-22/ed-1/seq-1/#words=Band+band+Cadet+rallies+RALLY+rally+Rally+rallys,1925-10-22,Other Band,-,Special from Kansas Coming,"University of Kansas students are on their way to Lincoln, bringing with them the 92 person band.",
band.nsp.0184,nebnewspapers,The Daily Nebraskan,https://nebnewspapers.unl.edu/lccn/sn96080312/1925-10-22/ed-1/seq-1/#words=Band+band+Cadet+rallies+RALLY+rally+Rally+rallys,1925-10-22,Cheer & Pep; Homecoming,"Bearg, Ernest; Allen, Forrest Clare ""Phog""",K. U. Athletic Director Will Talk At Rally,"The band will perform at the Homecoming rally, where several members of the University of Kansas's athletic department will be speaking.",
band.nsp.0185,nebnewspapers,The Daily Nebraskan,https://nebnewspapers.unl.edu/lccn/sn96080312/1929-11-07/ed-1/seq-1/#words=Band+band+cadet+RALLY+rally,1929-11-07,Cheer & Pep; Sports,-,Freshmen Lay Plans for Football Rally,A freshman rally is being organized at the Armory for the freshmen football team's Missouri game. The band will be performing.,
band.nsp.0186,nebnewspapers,The Daily Nebraskan,https://nebnewspapers.unl.edu/lccn/sn96080312/1929-11-07/ed-1/seq-1/#words=Band+band+cadet+RALLY+rally,1929-11-07,Travel,"Quick, W. T.; Pauley, Carroll R.",U.P. Announces $2.75 Rate for Manhattan Trip,"The Union Pacific is offering a round trip price of $2.75 for the Scarlet and Cream special to Manhattan, Kansas. The band will be traveling on the special to the game.",
band.nsp.0187,nebnewspapers,The Daily Nebraskan,https://nebnewspapers.unl.edu/lccn/sn96080312/1923-10-05/ed-1/seq-1/#words=band+cadet+cadets+rally,1923-10-05,Sports; Cheer & Pep,-,Grid-Graph to Help Organize Cheer Section,"A new device powered by electricity will be used in Lincoln to indicate the position of the football and players in Illinois. The band will be performing at the ""Grid-Graph Party"" at the Armory.",
band.nsp.0188,nebnewspapers,The Daily Nebraskan,https://nebnewspapers.unl.edu/lccn/sn96080312/1923-10-05/ed-1/seq-1/#words=band+cadet+cadets+rally,1923-10-05,Cheer & Pep; Parade,-,Cornhuskers Off to Meet Illini Team,The band and Innocents leads a four block parade to send the football team off to Illinois.,
band.nsp.0189,nebnewspapers,The Daily Nebraskan,https://nebnewspapers.unl.edu/lccn/sn96080312/1928-11-25/ed-1/seq-1/#words=Band+Cadet+CADET+cadet+Cadets+CADETS+RALLY,1928-11-25,Cheer & Pep; Travel,-,Student Rally Will Welcome Players Home,"The football team and band return from West Point at the Burlington depot, where they will be greeted by the student body.",
band.nsp.0190,nebnewspapers,The Daily Nebraskan,https://nebnewspapers.unl.edu/lccn/sn96080312/1929-10-15/ed-1/seq-1/#words=band+Band+cadet+cadets+rallies+Rally+RALLY+rally+Rallying,1929-10-15,Parade,"Bible, Dana X.",Gigantic Rally Holds Sway at Station Tonight,The band will lead a parade from Social Sciences to the Rock Island Station at 20th and O to welcome back the football team from Syracuse.,
band.nsp.0191,nebnewspapers,The Daily Nebraskan,https://nebnewspapers.unl.edu/lccn/sn96080312/1926-11-18/ed-1/seq-1/#words=band+Band+Cadet+rally+RALLY,1926-11-18,Events & Dances; Fundraising & Finance,-,Dance Ticket Sale is Large,"The R. O. T. C. band benefit tickets are selling well, and entertainment and food have been arranged for the event. The University of New York football team will be in attendance. The band will perform at the west entrance of the Social Science building to raise awareness and sell additional tickets.",
band.nsp.0192,nebnewspapers,The Daily Nebraskan,https://nebnewspapers.unl.edu/lccn/sn96080312/1926-11-18/ed-1/seq-1/#words=band+Band+Cadet+rally+RALLY,1926-11-18,Travel; Fundraising & Finance,"Schulte, Henry",Coaches and Athletes Endorse Sending Band to Seattle Game,The student body and football team supports sending part of the band to Seattle for the game on Thanksgiving day. The band will be sponsoring a benefit dance in order to fundraise for this travel.,
band.nsp.0193,nebnewspapers,The Daily Nebraskan,https://nebnewspapers.unl.edu/lccn/sn96080312/1926-11-18/ed-1/seq-1/#words=band+Band+Cadet+rally+RALLY,1926-11-18,Parade; Cheer & Pep,"Bearg, Ernest",Last Rally of Year is Friday,"A torchlight parade will end the football rally season, as the band and cheerleaders lead from the Social Science building to the Hotel Cornhusker.",
band.nsp.0194,nebnewspapers,The Daily Nebraskan,https://nebnewspapers.unl.edu/lccn/sn96080312/1922-02-23/ed-1/seq-1/#words=BAND+band+Band+bands+Cadet+CADET+cadet+rallied,1922-02-23,Concert,"Quick, W. T.",University Band Will Play at Convocation,The band gives its first concert of the season at the Temple for convocation.  The article goes on to mention the success that band alumni have enjoyed playing with orchestras regionally and nationally.,
band.nsp.0195,nebnewspapers,The Daily Nebraskan,https://nebnewspapers.unl.edu/lccn/sn96080312/1922-10-08/ed-1/seq-1/#words=Band+band+cadet+rally+RALLY+Rally,1922-10-08,Events & Dances; Fundraising & Finance; Uniform & Equipment,-,Benefit Mixer for Band Huge Success,"A benefit is held for the band, with music by Leo Beck's orchestra. The band will soon receive new uniforms, modeled after the R. O. T. C. officer uniforms.",
band.nsp.0196,nebnewspapers,The Daily Nebraskan,https://nebnewspapers.unl.edu/lccn/sn96080312/1922-10-08/ed-1/seq-1/#words=Band+band+cadet+rally+RALLY+Rally,1922-10-08,Cheer & Pep; Sports,"Dawson, Fred",Two Thousand Attend Rally,"The band plays ""Cornhusker"" at the opening Armory rally of the year, attended by 2,000 students. Freshmen are encouraged to trade their high school sweaters for Nebraska gear.",
band.nsp.0197,nebnewspapers,The Daily Nebraskan,https://nebnewspapers.unl.edu/lccn/sn96080312/1928-10-17/ed-1/seq-2/#words=band+cadet+cadets+RALLY+rally,1928-10-17,Cheer & Pep; Parade,-,Rally Planned for Dads and Visitors,"A parade is planned through downtown Lincoln as a part of the ""noise party."" Any ""visiting Dad"" is invited.",
band.nsp.0198,nebnewspapers,The Daily Nebraskan,https://nebnewspapers.unl.edu/lccn/sn96080312/1928-10-17/ed-1/seq-2/#words=band+cadet+cadets+RALLY+rally,1928-10-17,Military,-,Delt-Phi Delt Bell Formerly Reposed in Belfry Tower of Seward Church,"Research reveals that during their annual summer retreat in 1898, Cadet members stole a bell from a Black church, which has since been passed between fraternity houses. ",
band.nsp.0199,nebnewspapers,The Daily Nebraskan,https://nebnewspapers.unl.edu/lccn/sn96080312/1925-03-31/ed-1/seq-2/#words=Band+Cadet+cadet+rally+RALLY,1925-03-31,Cheer & Pep; Sports,"Schulte, Henry",To Hold Track Rally Tonight,"The band will play at a rally for the varsity track squad, although there will be no parade.",
band.nsp.0200,nebnewspapers,The Daily Nebraskan,https://nebnewspapers.unl.edu/lccn/sn96080312/1923-11-13/ed-1/seq-1/#words=band+cadet+Cadets+cadets+rally,1923-11-13,Travel; Cheer & Pep,-,"""700 to Ames"" is Aim of Corncobs",The Corncobs are selling tickets for a special to Ames for $10.70. The band will be accompanying the football team to Iowa.,
band.nsp.0201,nebnewspapers,The Daily Nebraskan,https://nebnewspapers.unl.edu/lccn/sn96080312/1927-11-09/ed-1/seq-2/,1927-11-09,Cheer & Pep; Parade,-,Send-Off Rally Scheduled for This Afternoon,The band will perform at a rally sending the football team to Pittsburgh. Students will parade from Social Sciences to the Burlington Station.,
band.nsp.0202,nebnewspapers,The Daily Nebraskan,https://nebnewspapers.unl.edu/lccn/sn96080312/1923-04-18/ed-1/seq-1/#words=Band+Cadet+rally+Rally,1923-04-18,Events & Dances; Drill,-,Plans Started for Breaking of Stadium Ground,The band will be performing at a ceremony for the stadium's ground breaking. Many alumni will be present.,
band.nsp.0203,nebnewspapers,The Daily Nebraskan,https://nebnewspapers.unl.edu/lccn/sn96080312/1923-09-27/ed-1/seq-1/#words=band+Cadet+RALLY+rally,1923-09-27,Cheer & Pep,"Avery, Samuel; Schulte, Henry",Initial Rally for Freshmen to Come Today,The band will play for the freshman class's convocation.,
band.nsp.0204,nebnewspapers,The Daily Nebraskan,https://nebnewspapers.unl.edu/lccn/sn96080312/1928-10-12/ed-1/seq-1/#words=band+Band+Cadet+cadets+RALLY+rally,1928-10-12,Cheer & Pep,"Ayres, W. Joyce",Fight for U-N-I' is Theme from New Husker Melody,"The band will play the new song ""Fight Nebraska"" by Joyce Ayres and Lamar Burling. The song will be distributed to students so that they might memorize the lyrics for football season.",
band.nsp.0205,nebnewspapers,The Daily Nebraskan,https://nebnewspapers.unl.edu/lccn/sn96080312/1928-10-12/ed-1/seq-1/#words=band+Band+Cadet+cadets+RALLY+rally,1928-10-12,Cheer & Pep,-,Students Will Vent Ardor at Monster Rally,The band will perform at a Coliseum rally for the Montana game.,
band.nsp.0206,nebnewspapers,The Daily Nebraskan,https://nebnewspapers.unl.edu/lccn/sn96080312/1927-02-27/ed-1/seq-1/#words=band+Band+BAND+band%27s+CADET+Cadet+Rally,1927-02-27,Concert,"Quick, W. T.",Band Plays at Coliseum Today,"The band and Glee Club will give a concert, free to the public.",
